{
  "type": "station_sample",
  "version": "0.2",
  "stamp": "2026-10-10T05:12:33.120Z",
  "device_id": "fix_01",
  "latitude": 35.8242,
  "longitude": 127.148,
  "altitude_msl": 40.0,
  "sampling_mode": 0,
  "avg_window_s": 60,
  "gas": {
    "stamp": "2026-10-10T05:12:33.120Z",
    "device_id": "fix_01",
    "h2s_ppm": 0.012,
    "nh3_ppm": 1.23,
    "tvoc_ppb": null,
    "temperature_c": 18.62,
    "humidity_pct": 71.3,
    "pump_on": false,
    "payload_voltage": null,
    "eco2_ppm": null,
    "voc_index": 112.0,
    "nox_index": 1.0,
    "pressure_hpa": null,
    "gas_resistance_ohm": null,
    "pm1_0_ugm3": 8.0,
    "pm2_5_ugm3": 13.0,
    "pm10_ugm3": 21.0,
    "nh3_raw": 14760.0,
    "h2s_raw": 240.0,
    "flags": 0
  },
  "seq": 1287,
  "rssi_dbm": -87,
  "received": "2026-10-10T05:12:34.420Z"
}
